{
  "discoveries": [
    {
      "artifactPaths": [
        "Sources/FoveaStorage/FoveaBlockingIOExecutor.swift"
      ],
      "evidencePaths": [
        "Tests/FoveaTests/BlockingIOExecutorTests.swift"
      ],
      "evidenceTestIDs": [],
      "extractedAsset": "Fovea-owned BlockingIOExecutor for host persistence boundaries; the exact-pinned Akashic package independently maintains its own equivalent storage execution boundary.",
      "id": "FOVEA-EGG-001",
      "observation": "多个存储 actor 都需要保持串行事务语义，同时把阻塞工作移出协作式执行器。",
      "overgeneralizationRisk": "把所有异步网络或 CPU 工作也放入串行队列会制造队头阻塞和优先级反转。",
      "principleIDs": [
        "FOVEA-LAW-002",
        "FOVEA-LAW-003",
        "FOVEA-LAW-014"
      ],
      "status": "promoted",
      "title": "阻塞 I/O 执行隔离器",
      "transferBoundary": "适用于必须保持 actor 串行事务、但底层 API 是同步阻塞 I/O 的内部实现。",
      "triggerProblem": "同步文件系统调用会占用 Swift cooperative executor，并把 actor 事务与线程阻塞混在一起。"
    },
    {
      "artifactPaths": [
        "Sources/FoveaCore/AsyncPermitPool.swift"
      ],
      "evidencePaths": [
        "Tests/FoveaTests/PrioritySchedulingTests.swift",
        "Tests/FoveaTests/ResourceLimitTests.swift"
      ],
      "evidenceTestIDs": [
        "RES-PT-001",
        "RES-PT-002"
      ],
      "extractedAsset": "使用 Swift ~Copyable 和 consuming 操作表达一次性许可。",
      "id": "FOVEA-EGG-002",
      "observation": "资源许可本质是线性所有权，不是普通值。",
      "overgeneralizationRisk": "对普通不可变值滥用不可复制语义会增加调用复杂度而无安全收益。",
      "principleIDs": [
        "FOVEA-LAW-001",
        "FOVEA-LAW-002"
      ],
      "status": "promoted",
      "title": "不可复制资源许可",
      "transferBoundary": "适用于容量、锁票据、事务 lease 等必须恰好消费一次的内部能力值。",
      "triggerProblem": "可复制 Permit 允许同一逻辑容量被复制后并发消费。"
    },
    {
      "artifactPaths": [
        "Sources/FoveaPersistence/FoveaManagedFileMetadata.swift"
      ],
      "evidencePaths": [
        "Tests/FoveaTests/FilesystemLinkDefenseTests.swift"
      ],
      "evidenceTestIDs": [
        "SEC-CASE-031"
      ],
      "extractedAsset": "FoveaManagedFileMetadata centralizes secure host-side metadata validation; Akashic storage internals remain independently versioned behind the exact component pin.",
      "id": "FOVEA-EGG-003",
      "observation": "所有受管文件读取都需要同一组 O_NOFOLLOW、类型、属主和链接数不变量。",
      "overgeneralizationRisk": "不能把单链接普通文件策略直接用于用户文档、共享 inode 或需要 symlink 语义的目录。",
      "principleIDs": [
        "FOVEA-LAW-001",
        "FOVEA-LAW-003",
        "FOVEA-LAW-014"
      ],
      "status": "promoted",
      "title": "受管文件元数据验证器",
      "transferBoundary": "适用于应用容器内由 Akashic 管理的普通单链接文件。",
      "triggerProblem": "FileManager 时间戳读取会跟随 symlink，使外部 inode 影响缓存淘汰。"
    },
    {
      "artifactPaths": [
        "Tests/FoveaTests/TestSupport.swift"
      ],
      "evidencePaths": [
        "Tests/FoveaTests/ResourceLimitTests.swift",
        "Tests/FoveaTests/AuthenticationRefreshTests.swift",
        "Tests/FoveaTests/SharedTaskTests.swift",
        "Tests/FoveaTests/FoveaSystemPipelineTests.swift"
      ],
      "evidenceTestIDs": [
        "RES-PT-002"
      ],
      "extractedAsset": "TestSupport.waitUntil 提供有截止时间、可取消、调用点失败定位的条件等待；测试以 transport 计数、诊断事件和 actor gate 表达阶段到达。",
      "id": "FOVEA-EGG-004",
      "observation": "并发测试应等待可观察状态，而不是等待推测时间。",
      "overgeneralizationRisk": "忙轮询本身仍可能形成脆弱测试；优先使用 continuation、actor gate 或事件流。",
      "principleIDs": [
        "FOVEA-LAW-003",
        "FOVEA-LAW-006",
        "FOVEA-LAW-013"
      ],
      "status": "promoted",
      "title": "确定性阶段同步替代固定睡眠",
      "transferBoundary": "适用于需要证明任务已进入特定阶段的并发测试。",
      "triggerProblem": "ASan 和覆盖插桩改变启动速度后，依赖 20ms 固定睡眠的并发测试偶发失败。"
    },
    {
      "artifactPaths": [
        "Sources/FoveaHTTP/HTTPVary.swift"
      ],
      "evidencePaths": [
        "Tests/FoveaTests/VaryCacheTests.swift"
      ],
      "evidenceTestIDs": [
        "CACHE-PT-004"
      ],
      "extractedAsset": "HTTPVarySelection 构造、选择和 Codable 解码共享唯一规范化实现。",
      "id": "FOVEA-EGG-005",
      "observation": "同一缓存身份语义存在多个规范化入口时会产生同义多键。",
      "overgeneralizationRisk": "通用逗号拆分会破坏带引号或自定义字段语义。",
      "principleIDs": [
        "FOVEA-LAW-001",
        "FOVEA-LAW-010",
        "FOVEA-LAW-012"
      ],
      "status": "promoted",
      "title": "Vary 唯一规范化来源",
      "transferBoundary": "适用于已知可安全规范化的 HTTP 列表字段；自定义字段只去除 OWS。",
      "triggerProblem": "公开构造器与管线内部对 Accept-Language/Accept-Encoding 使用不同规范化规则。"
    },
    {
      "artifactPaths": [
        "docs/project-memory/component-pins.json",
        "Tests/FoveaTests/ImageDecoderTests.swift"
      ],
      "evidencePaths": [
        "Tests/FoveaTests/ImageDecoderTests.swift"
      ],
      "evidenceTestIDs": [
        "SEC-CASE-004"
      ],
      "extractedAsset": "The exact-pinned ImageCraftImageIO backend provides complete bounded container scanning, while Fovea retains host-level decoder and security integration tests.",
      "id": "FOVEA-EGG-006",
      "observation": "安全预算必须覆盖整个容器生命周期，而非只覆盖第一段可解码前缀。",
      "overgeneralizationRisk": "手写容器解析若扩展到更多格式而无 corpus/fuzz，会扩大攻击面。",
      "principleIDs": [
        "FOVEA-LAW-004",
        "FOVEA-LAW-008"
      ],
      "status": "promoted",
      "title": "完整容器扫描而非首标记早退",
      "transferBoundary": "适用于当前静态 JPEG/PNG 安全预检，不等价于通用媒体解析器。",
      "triggerProblem": "JPEG 解析在首个 SOS 返回，使后续扫描间 APP 元数据绕过预算；PNG IEND 后尾随数据被接受。"
    },
    {
      "artifactPaths": [
        "Sources/FoveaCore/PipelineCache.swift"
      ],
      "evidencePaths": [
        "Tests/FoveaTests/CacheRefreshTransactionTests.swift"
      ],
      "evidenceTestIDs": [
        "CACHE-PT-039"
      ],
      "extractedAsset": "写前捕获旧 snapshot，并按 generation 活性选择恢复或删除。",
      "id": "FOVEA-EGG-007",
      "observation": "覆盖事务与首次插入事务需要不同回滚信息。",
      "overgeneralizationRisk": "namespace 已撤销时恢复旧 snapshot 会复活无权限数据。",
      "principleIDs": [
        "FOVEA-LAW-001",
        "FOVEA-LAW-002",
        "FOVEA-LAW-008"
      ],
      "status": "promoted",
      "title": "同 variant 覆盖事务快照",
      "transferBoundary": "适用于同 key 覆盖且失败时允许恢复旧值的事务。",
      "triggerProblem": "200 覆盖旧 record 后取消，回滚删除新 record 却未恢复旧 record。"
    },
    {
      "artifactPaths": [
        "Sources/FoveaCore/Diagnostics.swift",
        "Sources/FoveaHTTP/TransportNetworkMetrics.swift"
      ],
      "evidencePaths": [
        "Tests/FoveaTests/DiagnosticsTests.swift",
        "Tests/FoveaTests/URLSessionTransportTests.swift"
      ],
      "evidenceTestIDs": [
        "DIAG-PT-013"
      ],
      "extractedAsset": "DiagnosticEvent 构造与 Codable 解码共享摘要、数值、时长和协议集合上界。",
      "id": "FOVEA-EGG-008",
      "observation": "隐私清洗应在结构化事件构造边界完成，而不是依赖每个 exporter 补救。",
      "overgeneralizationRisk": "过度清洗可能损失调试价值；新增字段需明确有限词汇和单位。",
      "principleIDs": [
        "FOVEA-LAW-004",
        "FOVEA-LAW-006",
        "FOVEA-LAW-011"
      ],
      "status": "promoted",
      "title": "诊断边界前移",
      "transferBoundary": "适用于 Fovea 公共诊断模型，不替代宿主对额外日志字段的治理。",
      "triggerProblem": "OSLog 出口会过滤非法 keyDigest，但内存 sink 和自定义出口仍可能接触原始自由文本。"
    },
    {
      "artifactPaths": [
        "scripts/run-critical-mutants.py",
        "scripts/validate-critical-mutation-report.py"
      ],
      "evidencePaths": [
        "docs/schemas/critical-mutation-report.schema.json"
      ],
      "evidenceTestIDs": [
        "AIQA-GATE-010"
      ],
      "extractedAsset": "树绑定 checkpoint、源码定位更新、invalid 硬失败和报告摘要校验。",
      "id": "FOVEA-EGG-009",
      "observation": "变异测试工具本身会随架构腐化，invalid 不能被当作 killed。",
      "overgeneralizationRisk": "只追求 mutant 数量会鼓励低价值或等价变异。",
      "principleIDs": [
        "FOVEA-LAW-009",
        "FOVEA-LAW-013",
        "FOVEA-LAW-014"
      ],
      "status": "promoted",
      "title": "变异目录自校准",
      "transferBoundary": "适用于当前 curated critical mutants；不替代通用 mutation engine。",
      "triggerProblem": "职责拆分后 13 个关键 mutant 因源码定位过时而变成 invalid。"
    },
    {
      "artifactPaths": [
        "scripts/check-structural-quality.py"
      ],
      "evidencePaths": [
        "docs/specifications/pipeline-configuration.md"
      ],
      "evidenceTestIDs": [
        "PIPE-PT-010"
      ],
      "extractedAsset": "结构门同时约束文件规模、函数复杂度、类型规模、模块文件数和依赖环。",
      "id": "FOVEA-EGG-010",
      "observation": "降低单文件复杂度可能把认知成本迁移为文件和依赖碎片。",
      "overgeneralizationRisk": "固定阈值不能替代对领域内聚和调用图的人工判断。",
      "principleIDs": [
        "FOVEA-LAW-010",
        "FOVEA-LAW-012"
      ],
      "status": "promoted",
      "title": "职责拆分必须同时限制碎片化",
      "transferBoundary": "适用于当前 Swift 模块规模的启发式门禁。",
      "triggerProblem": "拆分 PipelineFailure 和 FetchStage 后，FoveaCore 文件数超过模块上限。"
    },
    {
      "artifactPaths": [
        "Examples/FoveaWorkbenchApp/FoveaWorkbench/Views/WorkbenchRootView.swift",
        "Examples/FoveaWorkbenchApp/FoveaWorkbench/Models/EcologicalAtlas.swift",
        "Examples/FoveaWorkbenchApp/FoveaWorkbench/Resources/ecological-atlas.json",
        "Examples/FoveaWorkbenchApp/FoveaWorkbench/Views/EcologicalAtlasHomeView.swift",
        "Examples/FoveaWorkbenchApp/FoveaWorkbench/Views/EcologicalStoryView.swift"
      ],
      "evidencePaths": [
        "Examples/FoveaWorkbenchApp/FoveaWorkbenchUITests/FoveaWorkbenchUITests.swift",
        "Examples/FoveaWorkbenchApp/FoveaWorkbenchUITests/FoveaWorkbenchIPadUITests.swift"
      ],
      "evidenceTestIDs": [
        "DEMO-PT-021",
        "DEMO-PT-022",
        "DEMO-PT-023",
        "DEMO-PT-024",
        "DEMO-PT-025",
        "DEMO-PT-026",
        "DEMO-PT-027",
        "DEMO-PT-028"
      ],
      "extractedAsset": "理解、验证、证据、设置四层信息架构；理解层由 8 卷、32 专题、8 种媒体表面和 160 个媒体身份组成，并以机制—分配—争议—综合判断组织内容，完整图片实验场仍从二级入口可达。",
      "id": "FOVEA-EGG-011",
      "observation": "系统内部领域分类适合实现所有权，不等于用户心智模型。公共叙事只有在内容 schema、证据标签、争议结构和图片负载契约都可执行时，才是真实宿主而不是议题包装。",
      "overgeneralizationRisk": "专题数量和页面样式不等于内容深度；若来源闭包、反方论证、图片身份或 UI 自动化缺失，复杂界面仍可能只是装饰。",
      "principleIDs": [
        "FOVEA-LAW-010",
        "FOVEA-LAW-012",
        "FOVEA-LAW-013",
        "FOVEA-LAW-014"
      ],
      "status": "promoted",
      "title": "叙事任务优先且证据分层的信息架构",